<?xml version="1.0" encoding="UTF-8"?>
<presetting xmlns="http://bioinformatics.hochschule-stralsund.de/presetting" xmlns:xsi="http://www.w3.org/2001/XMLSchema-instance"
            xsi:schemaLocation="http://bioinformatics.hochschule-stralsund.de/presetting ../presetting.xsd ">
  <geometry>
    <alpha>50.0</alpha>
    <beta>-140.0</beta>
    <gamma>0.0</gamma>
    <delta>0.0</delta>
    <epsilon>-70.0</epsilon>
    <phi>30.0</phi>
    <zeta>10.0</zeta>
    <nucCenterDistance>3.3</nucCenterDistance>
    <segLength>8</segLength>
  </geometry>
  <parameterlist>
    <parameter>
      <name>MIN_SEGMENT_LENGTH</name>
      <value>2</value>
    </parameter>
    <parameter>
      <name>MAX_SEGMENT_LENGTH</name>
      <value>8</value>
    </parameter>
    <parameter>
      <name>NUCLEOSOME_REPEAT_LENGTH</name>
      <value>187L</value>
    </parameter>
    <parameter>
      <name>MODE</name>
      <value>pbc</value>
    </parameter>
  </parameterlist>
  <potential>LJ</potential>
</presetting>
